{
  "board": "ortho",
  "keys": {
    "'": {
      "row": 0,
      "col": 11,
      "finger": "RP"
    },
    ",": {
      "row": 2,
      "col": 3,
      "finger": "LI"
    },
    ".": {
      "row": 0,
      "col": 3,
      "finger": "LI"
    },
    "a": {
      "row": 1,
      "col": 3,
      "finger": "LI"
    },
    "b": {
      "row": 2,
      "col": 5,
      "finger": "RI"
    },
    "c": {
      "row": 0,
      "col": 7,
      "finger": "RM"
    },
    "d": {
      "row": 1,
      "col": 5,
      "finger": "RI"
    },
    "e": {
      "row": 1,
      "col": 2,
      "finger": "LM"
    },
    "f": {
      "row": 0,
      "col": 10,
      "finger": "RP"
    },
    "g": {
      "row": 0,
      "col": 6,
      "finger": "RI"
    },
    "h": {
      "row": 1,
      "col": 0,
      "finger": "LP"
    },
    "i": {
      "row": 1,
      "col": 1,
      "finger": "LR"
    },
    "j": {
      "row": 0,
      "col": 9,
      "finger": "RP"
    },
    "k": {
      "row": 0,
      "col": 0,
      "finger": "LP"
    },
    "l": {
      "row": 0,
      "col": 8,
      "finger": "RR"
    },
    "m": {
      "row": 2,
      "col": 8,
      "finger": "RR"
    },
    "n": {
      "row": 1,
      "col": 8,
      "finger": "RR"
    },
    "o": {
      "row": 1,
      "col": 4,
      "finger": "LI"
    },
    "p": {
      "row": 2,
      "col": 6,
      "finger": "RI"
    },
    "q": {
      "row": 2,
      "col": 4,
      "finger": "LI"
    },
    "r": {
      "row": 1,
      "col": 7,
      "finger": "RM"
    },
    "s": {
      "row": 1,
      "col": 9,
      "finger": "RP"
    },
    "t": {
      "row": 1,
      "col": 6,
      "finger": "RI"
    },
    "u": {
      "row": 0,
      "col": 1,
      "finger": "LR"
    },
    "v": {
      "row": 0,
      "col": 5,
      "finger": "RI"
    },
    "w": {
      "row": 2,
      "col": 7,
      "finger": "RM"
    },
    "x": {
      "row": 2,
      "col": 0,
      "finger": "LP"
    },
    "y": {
      "row": 2,
      "col": 1,
      "finger": "LR"
    },
    "z": {
      "row": 2,
      "col": 9,
      "finger": "RP"
    },
    "ß": {
      "row": 1,
      "col": 10,
      "finger": "RP"
    },
    "ä": {
      "row": 0,
      "col": 4,
      "finger": "LI"
    },
    "ö": {
      "row": 2,
      "col": 2,
      "finger": "LM"
    },
    "ü": {
      "row": 0,
      "col": 2,
      "finger": "LM"
    }
  },
  "tag": "cmini",
  "blame": "cmini",
  "link": "http://www.adnw.de/"
}
