{
  "board": "stagger",
  "keys": {
    "'": {
      "row": 0,
      "col": 5,
      "finger": "RI"
    },
    ",": {
      "row": 2,
      "col": 7,
      "finger": "RM"
    },
    ".": {
      "row": 0,
      "col": 6,
      "finger": "RI"
    },
    "a": {
      "row": 1,
      "col": 8,
      "finger": "RR"
    },
    "b": {
      "row": 0,
      "col": 0,
      "finger": "LP"
    },
    "c": {
      "row": 2,
      "col": 2,
      "finger": "LI"
    },
    "d": {
      "row": 1,
      "col": 3,
      "finger": "LI"
    },
    "e": {
      "row": 1,
      "col": 7,
      "finger": "RM"
    },
    "f": {
      "row": 0,
      "col": 1,
      "finger": "LR"
    },
    "g": {
      "row": 1,
      "col": 4,
      "finger": "LI"
    },
    "h": {
      "row": 2,
      "col": 6,
      "finger": "RI"
    },
    "i": {
      "row": 1,
      "col": 9,
      "finger": "RP"
    },
    "j": {
      "row": 2,
      "col": 9,
      "finger": "RP"
    },
    "k": {
      "row": 1,
      "col": 5,
      "finger": "RI"
    },
    "l": {
      "row": 2,
      "col": 5,
      "finger": "RI"
    },
    "m": {
      "row": 2,
      "col": 3,
      "finger": "LI"
    },
    "n": {
      "row": 1,
      "col": 0,
      "finger": "LP"
    },
    "o": {
      "row": 0,
      "col": 8,
      "finger": "RR"
    },
    "p": {
      "row": 0,
      "col": 3,
      "finger": "LM"
    },
    "q": {
      "row": 2,
      "col": 0,
      "finger": "LP"
    },
    "r": {
      "row": 1,
      "col": 6,
      "finger": "RI"
    },
    "s": {
      "row": 1,
      "col": 1,
      "finger": "LR"
    },
    "t": {
      "row": 1,
      "col": 2,
      "finger": "LM"
    },
    "u": {
      "row": 0,
      "col": 7,
      "finger": "RM"
    },
    "v": {
      "row": 2,
      "col": 1,
      "finger": "LR"
    },
    "w": {
      "row": 0,
      "col": 4,
      "finger": "LI"
    },
    "x": {
      "row": 2,
      "col": 4,
      "finger": "LI"
    },
    "y": {
      "row": 0,
      "col": 9,
      "finger": "RP"
    },
    "z": {
      "row": 2,
      "col": 8,
      "finger": "RR"
    },
    "◇": {
      "row": 0,
      "col": 2,
      "finger": "LM"
    }
  },
  "magic": [
    {
      "inputs": "ue",
      "output": "uo",
      "type": "magic"
    },
    {
      "inputs": "'f",
      "output": "'l",
      "type": "magic"
    },
    {
      "inputs": "'l",
      "output": "'f",
      "type": "magic"
    },
    {
      "inputs": "jn",
      "output": "ju",
      "type": "magic"
    },
    {
      "inputs": "uo",
      "output": "ue",
      "type": "magic"
    },
    {
      "inputs": "ju",
      "output": "jn",
      "type": "magic"
    },
    {
      "inputs": "'◇",
      "output": "''",
      "type": "magic"
    },
    {
      "inputs": ".◇",
      "output": "..",
      "type": "magic"
    },
    {
      "inputs": "?◇",
      "output": "??",
      "type": "magic"
    },
    {
      "inputs": "a◇",
      "output": "ay",
      "type": "magic"
    },
    {
      "inputs": "b◇",
      "output": "bb",
      "type": "magic"
    },
    {
      "inputs": "c◇",
      "output": "cc",
      "type": "magic"
    },
    {
      "inputs": "d◇",
      "output": "dd",
      "type": "magic"
    },
    {
      "inputs": "e◇",
      "output": "ee",
      "type": "magic"
    },
    {
      "inputs": "f◇",
      "output": "ff",
      "type": "magic"
    },
    {
      "inputs": "g◇",
      "output": "gg",
      "type": "magic"
    },
    {
      "inputs": "h◇",
      "output": "hr",
      "type": "magic"
    },
    {
      "inputs": "i◇",
      "output": "ik",
      "type": "magic"
    },
    {
      "inputs": "j◇",
      "output": "jo",
      "type": "magic"
    },
    {
      "inputs": "k◇",
      "output": "ke",
      "type": "magic"
    },
    {
      "inputs": "l◇",
      "output": "ll",
      "type": "magic"
    },
    {
      "inputs": "m◇",
      "output": "mm",
      "type": "magic"
    },
    {
      "inputs": "n◇",
      "output": "nn",
      "type": "magic"
    },
    {
      "inputs": "o◇",
      "output": "oo",
      "type": "magic"
    },
    {
      "inputs": "p◇",
      "output": "pp",
      "type": "magic"
    },
    {
      "inputs": "q◇",
      "output": "qq",
      "type": "magic"
    },
    {
      "inputs": "r◇",
      "output": "rl",
      "type": "magic"
    },
    {
      "inputs": "s◇",
      "output": "ss",
      "type": "magic"
    },
    {
      "inputs": "t◇",
      "output": "tt",
      "type": "magic"
    },
    {
      "inputs": "u◇",
      "output": "u'",
      "type": "magic"
    },
    {
      "inputs": "v◇",
      "output": "vv",
      "type": "magic"
    },
    {
      "inputs": "w◇",
      "output": "ww",
      "type": "magic"
    },
    {
      "inputs": "x◇",
      "output": "xx",
      "type": "magic"
    },
    {
      "inputs": "y◇",
      "output": "ye",
      "type": "magic"
    },
    {
      "inputs": "z◇",
      "output": "zz",
      "type": "magic"
    }
  ],
  "tag": "cmini",
  "blame": "dmini"
}
