{
  "board": "ortho",
  "keys": {
    "'": {
      "row": 2,
      "col": 4,
      "finger": "LI"
    },
    "*": {
      "row": 3,
      "col": 0,
      "finger": "LT"
    },
    ",": {
      "row": 2,
      "col": 2,
      "finger": "LI"
    },
    ".": {
      "row": 1,
      "col": 4,
      "finger": "LI"
    },
    ";": {
      "row": 2,
      "col": 0,
      "finger": "LP"
    },
    "a": {
      "row": 1,
      "col": 2,
      "finger": "LM"
    },
    "b": {
      "row": 0,
      "col": 9,
      "finger": "RP"
    },
    "c": {
      "row": 0,
      "col": 7,
      "finger": "RM"
    },
    "d": {
      "row": 1,
      "col": 6,
      "finger": "RI"
    },
    "e": {
      "row": 1,
      "col": 1,
      "finger": "LR"
    },
    "f": {
      "row": 0,
      "col": 8,
      "finger": "RR"
    },
    "g": {
      "row": 2,
      "col": 7,
      "finger": "RI"
    },
    "h": {
      "row": 0,
      "col": 1,
      "finger": "LR"
    },
    "i": {
      "row": 1,
      "col": 0,
      "finger": "LP"
    },
    "j": {
      "row": 0,
      "col": 0,
      "finger": "LP"
    },
    "k": {
      "row": 0,
      "col": 5,
      "finger": "RI"
    },
    "l": {
      "row": 2,
      "col": 3,
      "finger": "LI"
    },
    "m": {
      "row": 2,
      "col": 6,
      "finger": "RI"
    },
    "n": {
      "row": 1,
      "col": 9,
      "finger": "RP"
    },
    "o": {
      "row": 0,
      "col": 2,
      "finger": "LM"
    },
    "p": {
      "row": 1,
      "col": 5,
      "finger": "RI"
    },
    "q": {
      "row": 2,
      "col": 9,
      "finger": "RP"
    },
    "r": {
      "row": 1,
      "col": 3,
      "finger": "LI"
    },
    "s": {
      "row": 1,
      "col": 8,
      "finger": "RR"
    },
    "t": {
      "row": 1,
      "col": 7,
      "finger": "RM"
    },
    "u": {
      "row": 0,
      "col": 3,
      "finger": "LI"
    },
    "v": {
      "row": 2,
      "col": 8,
      "finger": "RR"
    },
    "w": {
      "row": 2,
      "col": 5,
      "finger": "RI"
    },
    "x": {
      "row": 0,
      "col": 4,
      "finger": "LI"
    },
    "y": {
      "row": 0,
      "col": 6,
      "finger": "RM"
    },
    "z": {
      "row": 2,
      "col": 1,
      "finger": "LR"
    }
  },
  "magic": [
    {
      "inputs": "b*",
      "output": "bb",
      "type": "repeat"
    },
    {
      "inputs": "d*",
      "output": "dd",
      "type": "repeat"
    },
    {
      "inputs": "e*",
      "output": "ee",
      "type": "repeat"
    },
    {
      "inputs": "f*",
      "output": "ff",
      "type": "repeat"
    },
    {
      "inputs": "g*",
      "output": "gg",
      "type": "repeat"
    },
    {
      "inputs": "j*",
      "output": "jj",
      "type": "repeat"
    },
    {
      "inputs": "k*",
      "output": "kk",
      "type": "repeat"
    },
    {
      "inputs": "l*",
      "output": "ll",
      "type": "repeat"
    },
    {
      "inputs": "m*",
      "output": "mm",
      "type": "repeat"
    },
    {
      "inputs": "n*",
      "output": "nn",
      "type": "repeat"
    },
    {
      "inputs": "o*",
      "output": "oo",
      "type": "repeat"
    },
    {
      "inputs": "p*",
      "output": "pp",
      "type": "repeat"
    },
    {
      "inputs": "q*",
      "output": "qq",
      "type": "repeat"
    },
    {
      "inputs": "s*",
      "output": "ss",
      "type": "repeat"
    },
    {
      "inputs": "t*",
      "output": "tt",
      "type": "repeat"
    },
    {
      "inputs": "v*",
      "output": "vv",
      "type": "repeat"
    },
    {
      "inputs": "w*",
      "output": "ww",
      "type": "repeat"
    },
    {
      "inputs": "x*",
      "output": "xx",
      "type": "repeat"
    },
    {
      "inputs": "'*",
      "output": "'r",
      "type": "magic"
    },
    {
      "inputs": ".*",
      "output": "..",
      "type": "magic"
    },
    {
      "inputs": "a*",
      "output": "ay",
      "type": "magic"
    },
    {
      "inputs": "c*",
      "output": "ct",
      "type": "magic"
    },
    {
      "inputs": "h*",
      "output": "he",
      "type": "magic"
    },
    {
      "inputs": "i*",
      "output": "ic",
      "type": "magic"
    },
    {
      "inputs": "r*",
      "output": "rl",
      "type": "magic"
    },
    {
      "inputs": "u*",
      "output": "ul",
      "type": "magic"
    },
    {
      "inputs": "y*",
      "output": "yt",
      "type": "magic"
    },
    {
      "inputs": "z*",
      "output": "ze",
      "type": "magic"
    },
    {
      "inputs": "rb",
      "output": "r.",
      "type": "magic"
    },
    {
      "inputs": "td",
      "output": "ts",
      "type": "magic"
    },
    {
      "inputs": "rj",
      "output": "ru",
      "type": "magic"
    },
    {
      "inputs": "sj",
      "output": "sy",
      "type": "magic"
    },
    {
      "inputs": "uj",
      "output": "ur",
      "type": "magic"
    },
    {
      "inputs": "aq",
      "output": "ak",
      "type": "magic"
    },
    {
      "inputs": "uq",
      "output": "u'",
      "type": "magic"
    },
    {
      "inputs": "mv",
      "output": "mp",
      "type": "magic"
    }
  ],
  "tag": "cmini",
  "blame": "dmini"
}
