{
  "board": "stagger",
  "keys": {
    "'": {
      "row": 0,
      "col": 5,
      "finger": "RI"
    },
    "*": {
      "row": 0,
      "col": 2,
      "finger": "LM"
    },
    ",": {
      "row": 2,
      "col": 7,
      "finger": "RM"
    },
    ".": {
      "row": 0,
      "col": 6,
      "finger": "RI"
    },
    "a": {
      "row": 1,
      "col": 8,
      "finger": "RR"
    },
    "b": {
      "row": 0,
      "col": 0,
      "finger": "LP"
    },
    "c": {
      "row": 2,
      "col": 2,
      "finger": "LI"
    },
    "d": {
      "row": 1,
      "col": 3,
      "finger": "LI"
    },
    "e": {
      "row": 1,
      "col": 7,
      "finger": "RM"
    },
    "f": {
      "row": 0,
      "col": 1,
      "finger": "LR"
    },
    "g": {
      "row": 1,
      "col": 4,
      "finger": "LI"
    },
    "h": {
      "row": 2,
      "col": 6,
      "finger": "RI"
    },
    "i": {
      "row": 1,
      "col": 9,
      "finger": "RP"
    },
    "j": {
      "row": 2,
      "col": 9,
      "finger": "RP"
    },
    "k": {
      "row": 1,
      "col": 5,
      "finger": "RI"
    },
    "l": {
      "row": 2,
      "col": 5,
      "finger": "RI"
    },
    "m": {
      "row": 2,
      "col": 3,
      "finger": "LI"
    },
    "n": {
      "row": 1,
      "col": 0,
      "finger": "LP"
    },
    "o": {
      "row": 0,
      "col": 8,
      "finger": "RR"
    },
    "p": {
      "row": 0,
      "col": 3,
      "finger": "LM"
    },
    "q": {
      "row": 2,
      "col": 0,
      "finger": "LP"
    },
    "r": {
      "row": 1,
      "col": 6,
      "finger": "RI"
    },
    "s": {
      "row": 1,
      "col": 1,
      "finger": "LR"
    },
    "t": {
      "row": 1,
      "col": 2,
      "finger": "LM"
    },
    "u": {
      "row": 0,
      "col": 7,
      "finger": "RM"
    },
    "v": {
      "row": 2,
      "col": 1,
      "finger": "LR"
    },
    "w": {
      "row": 0,
      "col": 4,
      "finger": "LI"
    },
    "x": {
      "row": 2,
      "col": 4,
      "finger": "LI"
    },
    "y": {
      "row": 0,
      "col": 9,
      "finger": "RP"
    },
    "z": {
      "row": 2,
      "col": 8,
      "finger": "RR"
    }
  },
  "magic": [
    {
      "inputs": "d*",
      "output": "dd",
      "type": "repeat"
    },
    {
      "inputs": "e*",
      "output": "ee",
      "type": "repeat"
    },
    {
      "inputs": "f*",
      "output": "ff",
      "type": "repeat"
    },
    {
      "inputs": "l*",
      "output": "ll",
      "type": "repeat"
    },
    {
      "inputs": "o*",
      "output": "oo",
      "type": "repeat"
    },
    {
      "inputs": "s*",
      "output": "ss",
      "type": "repeat"
    },
    {
      "inputs": "t*",
      "output": "tt",
      "type": "repeat"
    },
    {
      "inputs": "a*",
      "output": "ar",
      "type": "magic"
    },
    {
      "inputs": "h*",
      "output": "hr",
      "type": "magic"
    },
    {
      "inputs": "i*",
      "output": "ik",
      "type": "magic"
    },
    {
      "inputs": "k*",
      "output": "ke",
      "type": "magic"
    },
    {
      "inputs": "n*",
      "output": "nk",
      "type": "magic"
    },
    {
      "inputs": "r*",
      "output": "rk",
      "type": "magic"
    },
    {
      "inputs": "he*",
      "output": "her",
      "type": "magic"
    },
    {
      "inputs": "ra*",
      "output": "ral",
      "type": "magic"
    }
  ],
  "tag": "cmini",
  "blame": "dmini"
}
